{
  "schemaVersion": 1,
  "assessmentId": "exp04_assessment",
  "version": "1.0.0",
  "experimentId": "exp04_standard_solution",
  "resultLabel": "practical competency estimate",
  "disclaimerKey": "assessment.exp04.disclaimer",
  "parameters": [
    {
      "parameterId": "param.mass_tolerance",
      "value": 0.05,
      "unit": "g",
      "rationale": "NIE pages give no mass tolerance (gap F3). About 0.2% of 26.5 g; within reach of a four beam balance read to 0.01 g.",
      "sourceType": "simulation_assumption",
      "reviewStatus": "teacher_review_pending",
      "effectCategory": "measurement_tolerance",
      "version": 1
    },
    {
      "parameterId": "param.slider_tolerance",
      "value": 0.01,
      "unit": "g",
      "rationale": "Slider setting must equal (26.5 + w) g to the assumed balance resolution (gap F3).",
      "sourceType": "simulation_assumption",
      "reviewStatus": "teacher_review_pending",
      "effectCategory": "measurement_tolerance",
      "version": 1
    },
    {
      "parameterId": "param.balance_resolution",
      "value": 0.01,
      "unit": "g",
      "rationale": "Four beam balance readability is not stated on the approved pages (gap F3); 0.01 g assumed for display rounding and the zero band.",
      "sourceType": "simulation_assumption",
      "reviewStatus": "teacher_review_pending",
      "effectCategory": "measurement_tolerance",
      "version": 1
    },
    {
      "parameterId": "param.concentration_relative_tolerance",
      "value": 0.01,
      "unit": "fraction",
      "rationale": "No concentration tolerance in NIE sources (gap F3). 1% relative error accepted as a provisional teaching threshold.",
      "sourceType": "simulation_assumption",
      "reviewStatus": "teacher_review_pending",
      "effectCategory": "measurement_tolerance",
      "version": 1
    },
    {
      "parameterId": "param.watch_glass_mass_range",
      "value": {
        "min": 20,
        "max": 40
      },
      "unit": "g",
      "rationale": "The handbook calls the watch-glass mass w g without a value; a seeded value in this range makes each session's w different but reproducible.",
      "sourceType": "simulation_assumption",
      "reviewStatus": "teacher_review_pending",
      "effectCategory": "initial_state",
      "version": 1
    },
    {
      "parameterId": "param.watch_glass_residue_fraction",
      "value": 0.004,
      "unit": "fraction",
      "rationale": "Fraction of transferred solid left on the watch glass if it is not rinsed (gap F16). Deterministic, about 0.1 g of 26.5 g.",
      "sourceType": "simulation_assumption",
      "reviewStatus": "teacher_review_pending",
      "effectCategory": "numeric_consequence",
      "version": 1
    },
    {
      "parameterId": "param.funnel_residue_fraction",
      "value": 0.003,
      "unit": "fraction",
      "rationale": "Fraction of solid passing through the funnel that stays in it if the funnel is not rinsed (gap F16). Deterministic.",
      "sourceType": "simulation_assumption",
      "reviewStatus": "teacher_review_pending",
      "effectCategory": "numeric_consequence",
      "version": 1
    },
    {
      "parameterId": "param.rinse_volume",
      "value": 10,
      "unit": "cm3",
      "rationale": "Volume of distilled water added to the flask by one rinse from the wash bottle; not stated in sources.",
      "sourceType": "simulation_assumption",
      "reviewStatus": "teacher_review_pending",
      "effectCategory": "numeric_consequence",
      "version": 1
    },
    {
      "parameterId": "param.eye_level_volume_error",
      "value": {
        "min": 0.3,
        "max": 1.0
      },
      "unit": "cm3",
      "rationale": "Seeded parallax error magnitude when the meniscus is judged with the eye above (+) or below (−) the mark (gap F2). Not an NIE value.",
      "sourceType": "simulation_assumption",
      "reviewStatus": "teacher_review_pending",
      "effectCategory": "numeric_consequence",
      "version": 1
    },
    {
      "parameterId": "param.required_inversions",
      "value": 10,
      "unit": "count",
      "rationale": "Handbook p.16 requires further mixing to homogenise but gives no count; 10 inversions assumed.",
      "sourceType": "simulation_assumption",
      "reviewStatus": "teacher_review_pending",
      "effectCategory": "homogeneity",
      "version": 1
    },
    {
      "parameterId": "param.flask_brim_fraction",
      "value": 1.1,
      "unit": "fraction",
      "rationale": "Maximum liquid a volumetric flask can hold, as a multiple of its nominal capacity; additions beyond this are physically impossible.",
      "sourceType": "simulation_assumption",
      "reviewStatus": "teacher_review_pending",
      "effectCategory": "numeric_consequence",
      "version": 1
    },
    {
      "parameterId": "param.demo_dissolution_water",
      "value": 100,
      "unit": "cm3",
      "rationale": "Volume used only by the automatic demonstration to represent 'a sufficient amount' of distilled water. The minimum volume needed to dissolve 26.5 g Na₂CO₃ is not on the approved sources and is not modelled; dissolution is a procedural/observational step (SOURCE_MAP F17).",
      "sourceType": "simulation_assumption",
      "reviewStatus": "teacher_review_pending",
      "effectCategory": "automatic_demonstration",
      "version": 1
    },
    {
      "parameterId": "param.demo_dropwise_margin",
      "value": 2,
      "unit": "cm3",
      "rationale": "How far below the mark the automatic demonstration stops bulk addition before using the dropper.",
      "sourceType": "simulation_assumption",
      "reviewStatus": "teacher_review_pending",
      "effectCategory": "automatic_demonstration",
      "version": 1
    },
    {
      "parameterId": "param.weight_safety",
      "value": 0.2,
      "unit": "weight",
      "rationale": "Provisional weight of the safety category in the practical competency estimate; not an NIE marking criterion.",
      "sourceType": "simulation_assumption",
      "reviewStatus": "teacher_review_pending",
      "effectCategory": "scoring",
      "version": 1
    },
    {
      "parameterId": "param.weight_technique",
      "value": 0.25,
      "unit": "weight",
      "rationale": "Provisional weight of the technique category in the practical competency estimate; not an NIE marking criterion.",
      "sourceType": "simulation_assumption",
      "reviewStatus": "teacher_review_pending",
      "effectCategory": "scoring",
      "version": 1
    },
    {
      "parameterId": "param.weight_measurement",
      "value": 0.25,
      "unit": "weight",
      "rationale": "Provisional weight of the measurement category in the practical competency estimate; not an NIE marking criterion.",
      "sourceType": "simulation_assumption",
      "reviewStatus": "teacher_review_pending",
      "effectCategory": "scoring",
      "version": 1
    },
    {
      "parameterId": "param.weight_completeness",
      "value": 0.15,
      "unit": "weight",
      "rationale": "Provisional weight of the completeness category in the practical competency estimate; not an NIE marking criterion.",
      "sourceType": "simulation_assumption",
      "reviewStatus": "teacher_review_pending",
      "effectCategory": "scoring",
      "version": 1
    },
    {
      "parameterId": "param.weight_independence",
      "value": 0.15,
      "unit": "weight",
      "rationale": "Provisional weight of the independence category in the practical competency estimate; not an NIE marking criterion.",
      "sourceType": "simulation_assumption",
      "reviewStatus": "teacher_review_pending",
      "effectCategory": "scoring",
      "version": 1
    },
    {
      "parameterId": "param.deduction_safety_not_confirmed",
      "value": 20,
      "unit": "points",
      "rationale": "Provisional points deducted from the error's category for SAFETY_NOT_CONFIRMED; not an NIE marking criterion.",
      "sourceType": "simulation_assumption",
      "reviewStatus": "teacher_review_pending",
      "effectCategory": "scoring",
      "version": 1
    },
    {
      "parameterId": "param.deduction_safety_checklist_incomplete",
      "value": 10,
      "unit": "points",
      "rationale": "Provisional points deducted from the error's category for SAFETY_CHECKLIST_INCOMPLETE; not an NIE marking criterion.",
      "sourceType": "simulation_assumption",
      "reviewStatus": "teacher_review_pending",
      "effectCategory": "scoring",
      "version": 1
    },
    {
      "parameterId": "param.deduction_chemical_skin_contact",
      "value": 30,
      "unit": "points",
      "rationale": "Provisional points deducted from the error's category for CHEMICAL_SKIN_CONTACT; not an NIE marking criterion.",
      "sourceType": "simulation_assumption",
      "reviewStatus": "teacher_review_pending",
      "effectCategory": "scoring",
      "version": 1
    },
    {
      "parameterId": "param.deduction_dirty_flask_used",
      "value": 25,
      "unit": "points",
      "rationale": "Provisional points deducted from the error's category for DIRTY_FLASK_USED; not an NIE marking criterion.",
      "sourceType": "simulation_assumption",
      "reviewStatus": "teacher_review_pending",
      "effectCategory": "scoring",
      "version": 1
    },
    {
      "parameterId": "param.deduction_dirty_glassware_used",
      "value": 15,
      "unit": "points",
      "rationale": "Provisional points deducted from the error's category for DIRTY_GLASSWARE_USED; not an NIE marking criterion.",
      "sourceType": "simulation_assumption",
      "reviewStatus": "teacher_review_pending",
      "effectCategory": "scoring",
      "version": 1
    },
    {
      "parameterId": "param.deduction_incomplete_transfer",
      "value": 25,
      "unit": "points",
      "rationale": "Provisional points deducted from the error's category for INCOMPLETE_TRANSFER; not an NIE marking criterion.",
      "sourceType": "simulation_assumption",